JAP;FR;COUNT;OUPS
Everything seems normal here.;Pour une forêt maudite, elle semble bien paisible.;345;Everything seems normal here.
We appear to have hit a dead end.;Hum, je ne vois pas ce qui pourrait être la cause de ces rumeurs.;346;We appear to have hit a dead end.
Hold a moment. What is that on the ground?;Un instant... Il y a quelque chose sur le sol.;347;Hold a moment. What is that on the ground?
Just some funny-looking berries.;Ce ne sont que des baies étranges.;348;Just some funny-looking berries.
I'd wager those berries are poisonous.;Je parie qu'elles sont vénéneuses.;349;I'd wager those berries are poisonous.
Maybe, but I'm not hungry enough to find out.;Peut-être, mais je ne vais pas risquer ma vie pour m'en assurer.;350;Maybe, but I'm not hungry enough to find out.
You guys solve the mystery yet?;Alors, vous avez découvert pourquoi les gens pensent que la forêt est maudite#?;351;You guys solve the mystery yet?
No. We got nothing.;Non. Nous sommes dans une impasse.;352;No. We got nothing.
...So what's with the berries?;... Alors, vous en avez profité pour cueillir des baies#?;353;...So what's with the berries?
We picked them up over by that huge tree. I thought maybe—;Nous les avons ramassées près d'un arbre. Je croyais que peut-être...;354;We picked them up over by that huge tree. I thought maybe—
Here, hand 'em over. I'm starving.;Donne, je meurs de faim.;355;Here, hand 'em over. I'm starving.
Are you mad! Those berries are clearly poisonous! Even one such as you can't hope to—;Aurais-tu perdu la tête#? Ces baies sont manifestement vénéneuses#! Même une traînée comme toi ne pourrait…;356;Are you mad! Those berries are clearly poisonous! Even one such as you can't hope to—
Damn, these are delicious! Gimme some more!;Putain, elles sont délicieuses#! Vous en avez d'autres#?;357;Damn, these are delicious! Gimme some more!
Really? Well in that case, I suppose I should try one...;Vraiment#? Eh bien, dans ce cas, je suppose que je devrais y goûter moi aussi...;358;Really? Well in that case, I suppose I should try one...
Ugh... Oooooh...<PAGE>I think Weiss was right about those berries... My stomach feels like somebody stuck a sword in there...;Aah... Oooooh...<PAGE>Je crois que Weiss avait raison... J'ai l'impression d'avoir avalé des dizaines de dagues...;359;Ugh... Oooooh...<PAGE>I think Weiss was right about those berries... My stomach feels like somebody stuck a sword in there...
Hey now, what's wrong? You look like...<PAGE>Oh no. OH NO! Don't tell me you ate one of those berries!?;Oh, qu'est-ce qui ne va pas#? Vous avez l'air...<PAGE>Oh non#! Non#! Ne me dites pas que vous avez mangé une de ces baies#?!;361;Hey now, what's wrong? You look like...<PAGE>Oh no. OH NO! Don't tell me you ate one of those berries!?
For the love of trees, those things are deadly! Quick! Take this antidote before you perish!;Elles sont mortelles#! De grâce#! Avalez vite ce contrepoison avant qu'il ne soit trop tard#!;362;For the love of trees, those things are deadly! Quick! Take this antidote before you perish!
I thought I was a goner there...;J'ai vraiment cru que j'étais fichu...;363;I thought I was a goner there...
What kind of an idiot are you!? Didn't you see the lumps? The unusual colors? Why, even a child would know better!;Vous êtes bête ou quoi#? N'avez-vous pas remarqué leur surface rugueuse#?;364;What kind of an idiot are you!? Didn't you see the lumps? The unusual colors? Why, even a child would know better!
"Look, I was just trying to... Wait, did you say ""child""?<PAGE> Oh, crap. I bet that kid ate one of these berries.";Leur couleur étrange#? Même un enfant aurait su faire preuve de plus de bon sens#! Écoutez, je n'essayais que... Attendez, avez-vous dit un enfant#?<PAGE>Mince, je parie que le garçon du village a avalé une de ces baies.;365;"Look, I was just trying to... Wait, did you say ""child""?<PAGE> Oh, crap. I bet that kid ate one of these berries."
It's quite possible. And if the poison is this painful to an adult, I can only imagine what it would do to a child.;Cela est fort possible. Et si le poison peut causer autant de douleur chez un adulte, qui sait à quel point ce petit doit souffrir#!;366;It's quite possible. And if the poison is this painful to an adult, I can only imagine what it would do to a child.
Hey, Kainé? Did you take the antidote?;Dis, Kainé, as-tu pris le contrepoison#?;368;Hey, Kainé? Did you take the antidote?
Don't need it.<PAGE>...God, those berries were amazing.;J'en ai pas besoin.<PAGE>Ces baies étaient vraiment incroyables.;369;Don't need it.<PAGE>...God, those berries were amazing.
The truly amazing thing is that your stomach is fouler than your taste in clothing!;Ce qui est vraiment incroyable est le fait que ton estomac soit aussi étrange que tes goûts en matière de vêtements.;370;The truly amazing thing is that your stomach is fouler than your taste in clothing!
If you had genitals, I would so chop them off right now.;Bouquin, si t'avais des couilles, je te les arracherais#!;371;If you had genitals, I would so chop them off right now.
<LIST=1087>Listen to your fortune.</LIST>;<LIST=1087>Accepter son offre.</LIST>;372;<LIST=1087>Listen to your fortune.</LIST>
<LIST=1069>Decline the offer.</LIST>;<LIST=1069>Refuser son offre.</LIST>;373;<LIST=1069>Decline the offer.</LIST>
I haven't had any dreams at all lately.;Je ne rêve plus du tout ces derniers temps.;375;I haven't had any dreams at all lately.
You know the Divine Tree? That's the great big tree we have inside the village.;Connaissez-vous l'arbre divin#? C'est l'arbre gigantesque situé au fond du village.;376;You know the Divine Tree? That's the great big tree we have inside the village.
How've you been lately? Me, I've been doing just great.;Bonjour#! Comment allez-vous#? Moi, je me porte à merveille#!;377;How've you been lately? Me, I've been doing just great.
