JAP;FR;COUNT;OUPS
Abruptly, the pair realized that <WAIT=0.2>they <WAIT=0.1>must <WAIT=0.1>listen.;<NIER> et Weiss comprirent brusquement qu'ils<WAIT=0.5> devaient<WAIT=0.5> écouter.<WAIT=0.2>;109;Abruptly, the pair realized that <WAIT=0.2>they <WAIT=0.1>must <WAIT=0.1>listen.
<WAIT=0.4>They  <WAIT=0.2>m <WAIT=0.15>us <WAIT=0.15>t  <WAIT=0.3>li <WAIT=0.2>st <WAIT=0.1>en!;Ils.<WAIT=0.3> Devaient.<WAIT=0.3> Écouter.;110;<WAIT=0.4>They  <WAIT=0.2>m <WAIT=0.15>us <WAIT=0.15>t  <WAIT=0.3>li <WAIT=0.2>st <WAIT=0.1>en!
Weiss: Look.;Weiss#: Regarde.;111;Weiss: Look.
A small, shadowy presence appeared from beneath the floor.;Une petite silhouette noire apparut de sous le plancher.;112;A small, shadowy presence appeared from beneath the floor.
It looked to be a Shade.;Elle semblait être une Ombre.;113;It looked to be a Shade.
The Shade grasped several jewels in its hand. More jewels tumbled out of its mouth like shards of broken teeth, sights and sounds tinkling from each one before vanishing forever. ;L'Ombre ramassa des cristaux. Elle en broyait déjà d'autres dans sa gueule, des fragments d'images et de sons s'en échappant en tintant avant de disparaître pour toujours.;114;The Shade grasped several jewels in its hand. More jewels tumbled out of its mouth like shards of broken teeth, sights and sounds tinkling from each one before vanishing forever. 
The creature was abusing the memories, treating the precious objects like a collection of cheap playroom toys.;La créature malmenait les souvenirs et s'amusait avec eux comme s'ils n'étaient que de vulgaires jouets.;115;The creature was abusing the memories, treating the precious objects like a collection of cheap playroom toys.
Weiss: This Shade appears to be consuming the memories.;Weiss#: Cette Ombre semble se nourrir de souvenirs.;116;Weiss: This Shade appears to be consuming the memories.
<NIER>: That little thing? It's barely worth my time to kill.;<NIER>#: Elle est si minuscule, ça ne vaut presque pas la peine de l'éliminer.;117;<NIER>: That little thing? It's barely worth my time to kill.
The tree extended a branch toward <NIER>.;L'arbre tendit une branche vers <NIER>.;118;The tree extended a branch toward <NIER>.
Without a second thought, <NIER> brought his blade down on the Shade, tearing its stomach wide.;Sans réfléchir, <NIER> éventra l'Ombre de son épée.;119;Without a second thought, <NIER> brought his blade down on the Shade, tearing its stomach wide.
Jewels burst from the Shade and poured across the chamber floor.<PAGE>;Une pluie de gemmes cristallines jaillit de l'Ombre et se répandit sur le sol.<PAGE>;120;Jewels burst from the Shade and poured across the chamber floor.<PAGE>
<FONT=ITALIC>Look,</FONT> thought the tree. <FONT=ITALIC>There is the Conviction memory I had lost. And Satisfaction. And many others as well. Yes, this is good.</FONT>;<FONT=ITALIC>Regardez,</FONT> pensa l'arbre. <FONT=ITALIC>Voilà le souvenir de conviction que j'avais perdu... Oh, et celui de satisfaction. Et tant d'autres... Oui, très bien.</FONT>;121;<FONT=ITALIC>Look,</FONT> thought the tree. <FONT=ITALIC>There is the Conviction memory I had lost. And Satisfaction. And many others as well. Yes, this is good.</FONT>
The tree opened its mouth and attempted to speak, but no sound emerged.;L'arbre essaya de parler, mais aucun son ne s'échappa de sa bouche.;122;The tree opened its mouth and attempted to speak, but no sound emerged.
A millennium of silence and solitude had caused the tree to forget certain things. But rather than be upset, it greeted the development with good cheer. <STOP>Focusing all its power on the riddle of speech, the tree formed a kind of makeshift vocal cord and tried again.<PAGE>;Un millénaire de silence et de solitude lui avait fait oublier certaines choses. Au lieu d'en être irrité, il se réjouit de cette découverte. <STOP>Concentrant toute son énergie à résoudre le mystère de la parole, l'arbre s'improvisa des cordes vocales et réessaya.;123;A millennium of silence and solitude had caused the tree to forget certain things. But rather than be upset, it greeted the development with good cheer. <STOP>Focusing all its power on the riddle of speech, the tree formed a kind of makeshift vocal cord and tried again.<PAGE>
Ahem! I... I implore... *HACK*!;Arhem#! Je... je vous... Kof, kof#!;124;Ahem! I... I implore... *HACK*!
It spat out a glimmering green jewel.;Il cracha un cristal émeraude.;125;It spat out a glimmering green jewel.
<FONT=ITALIC>Hmmm... One more time.</FONT>;<FONT=ITALIC>Hum... Essayons encore une fois.</FONT><PAGE>;126;<FONT=ITALIC>Hmmm... One more time.</FONT>
I implore you.;Je vous le demande.;127;I implore you.
<FONT=ITALIC>There we are.</FONT>;<FONT=ITALIC>Et voilà.</FONT>;128;<FONT=ITALIC>There we are.</FONT>
What was the color of the lost envy?;Quelle était la couleur de l'envie oubliée#?;129;What was the color of the lost envy?
<LIST=1035>Brown</LIST>;<LIST=1035>Brune</LIST>;132;<LIST=1035>Brown</LIST>
<LIST=1036>Green</LIST>;<LIST=1036>Verte</LIST>;133;<LIST=1036>Green</LIST>
<LIST=1037>Blue</LIST>;<LIST=1037>Bleue</LIST>;134;<LIST=1037>Blue</LIST>
Weiss: It spoke! ...This Shade has intelligence! And emotion!;Weiss#: Elle a parlé#! Cette Ombre est intelligente...! C'est un être sensible...!;138;Weiss: It spoke! ...This Shade has intelligence! And emotion!
<NIER>: Who cares?;<NIER>#: Je m'en fiche.;139;<NIER>: Who cares?
<NIER> brushed Weiss's comment aside as his sword sliced through the Shade's right arm.;Il balaya d'un geste les soucis de Weiss et trancha le bras droit de l'Ombre de son épée.;140;<NIER> brushed Weiss's comment aside as his sword sliced through the Shade's right arm.
The Shade extended its remaining arm to <NIER>. <FONT=ITALIC>I must must touch him. I must make contact.</FONT>;L'Ombre tendit son autre bras vers <NIER>. <FONT=ITALIC>Je dois le toucher. Je dois entrer en contact avec lui.</FONT>;141;The Shade extended its remaining arm to <NIER>. <FONT=ITALIC>I must must touch him. I must make contact.</FONT>
The moment its fingers brushed against <NIER>, the tree felt a warm sensation begin to burn. Something hot coursed through its fingers, up its arm, and out to its entire body.<PAGE>It was emotion, more than the entity had felt in centuries.;Dès que ses vrilles effleurèrent <NIER>, l'arbre éprouva une sensation de brulûre. Une pulsation incandescente parcourut ses branches et tout son être. C'étaient des émotions, des émotions d'une intensité telle que l'arbre n'en avait pas ressenti depuis des siècles...;142;The moment its fingers brushed against <NIER>, the tree felt a warm sensation begin to burn. Something hot coursed through its fingers, up its arm, and out to its entire body.<PAGE>It was emotion, more than the entity had felt in centuries.
The tree cried out in surprise and joy.;Surpris, l'arbre poussa un cri de joie.;143;The tree cried out in surprise and joy.
One thousand years alone. One thousand years in quiet contemplation.;Après mille ans de solitude, mille ans de contemplation profonde…;144;One thousand years alone. One thousand years in quiet contemplation.
<STOP>The tree felt like it was going to break apart.<PAGE>;<STOP>L'arbre crut qu'il allait éclater.;145;<STOP>The tree felt like it was going to break apart.<PAGE>
For long centuries, the tree had been alone, its heart sealed with heavy chains. But no more. <STOP>New, powerful emotions began to take hold, causing its heart to lighten. <STOP>This was more than the simple emotions it had been designed to feel: it was the beginnings of a soul.;Pendant des siècles, il avait été seul, son cœur chargé de lourdes chaînes. Plus maintenant.<PAGE>De nouvelles émotions puissantes ranimèrent et élevèrent son cœur, plus vives que celles que son créateur lui avait permis de ressentir... <STOP>Les rudiments d'une âme.;146;For long centuries, the tree had been alone, its heart sealed with heavy chains. But no more. <STOP>New, powerful emotions began to take hold, causing its heart to lighten. <STOP>This was more than the simple emotions it had been designed to feel: it was the beginnings of a soul.
And the man was the key.;Et cet homme en était la clef.;147;And the man was the key.
This was the promise made long ago. This was how it would be released. ;C'était la promesse faite il y a si longtemps. C'était ainsi qu'il serait libéré.;148;This was the promise made long ago. This was how it would be released. 
The tree's stomach began to throb in pain—a new and unpleasant sensation. ;L'intérieur de l'arbre fut pénétré de douleur, une sensation désagréable qui lui était inconnue.;149;The tree's stomach began to throb in pain—a new and unpleasant sensation. 
But the time was not yet right.;Le moment n'était pas encore venu.;150;But the time was not yet right.
I implore you: How many were lost by the warrior who fought the red-eyed beasts?;Je vous le demande. Combien d'êtres chers la guerrière qui a combattu les créatures aux yeux ardents a-t-elle perdus#?;151;I implore you: How many were lost by the warrior who fought the red-eyed beasts?
<LIST=1042>Her daughter and 23 friends</LIST>;<LIST=1042>Sa fille et vingt-trois compagnons.</LIST>;154;<LIST=1042>Her daughter and 23 friends</LIST>
<LIST=1043>Her daughter and 33 friends</LIST>;<LIST=1043>Sa fille et trente-trois compagnons.</LIST>;155;<LIST=1043>Her daughter and 33 friends</LIST>
<LIST=1044>Her daughter and 63 friends</LIST>;<LIST=1044>Sa fille et soixante-trois compagnons.</LIST>;156;<LIST=1044>Her daughter and 63 friends</LIST>
<NIER>: Okay, riddle time is over. I'm gonna kill this stupid Shade once and for all.;<NIER> : J'en ai assez de ces questions. Je vais éliminer cette Ombre une bonne fois pour toutes#!;160;<NIER>: Okay, riddle time is over. I'm gonna kill this stupid Shade once and for all.
Something round and shiny fell from the open stomach and clattered to the floor.;Un objet arrondi et brillant tomba de l'estomac de l'Ombre avec fracas.;161;Something round and shiny fell from the open stomach and clattered to the floor.
"The key! shouted the book. ""Grab the key!""";Weiss#: Le fragment#! Récupère le fragment#!;162;"The key! shouted the book. ""Grab the key!"""
The man's sword slowed.;L'épée de l'homme ralentit.;163;The man's sword slowed.
Time began to dilate around them, stretching and slowing. Time is essential. The next word must be heard.;Le temps se dilata autour d'eux, s'étirant, s'engourdissant... Le temps est indispensable. Le prochain mot doit être entendu.;164;Time began to dilate around them, stretching and slowing. Time is essential. The next word must be heard.
"The words exploded. It became diffi <WAIT=0.1>cult to discern their  m <WAIT=0.1>eaning. The p <WAIT=0.15>ool of <WAIT=0.05>memo <WAIT=0.2>ies began <WAIT=0.05>to cr  <WAIT=0.1>ack as  infinite black <WAIT=0.15>ness  burrowed its <WAIT=0.05>way into  the wall. <WAIT=0.5>Wei <WAIT=0.1>ss: ""Thi <WAIT=0.2>s world is fa  <WAIT=0.2>lling apart!"" <WAIT=0.5><NIER>: ""How can   <WAIT=0.2>a wo  <WAIT=0.1>rld of  le <WAIT=0.35>t<WAIT=0.25>er";Les mots explosèrent. Il devint diffi<WAIT=0.3>  cile de compren<WAIT=0.2>  dre leur si<WAIT=0.3>  gnifica<WAIT=0.3>  tion.<WAIT=0.3> Le bas<WAIT=0.2>  sin de la mé<WAIT=0.2>  moire se craque<WAIT=0.3>  la et des té<WAIT=0.3>  nèbres profon<WAIT=0.3>  des s'infil<WAIT=0.3>  trèrent dans le mur. Weiss#: Ce mon<WAIT=0.2>  de est en train de s'ef<WAIT=0.3>  fondrer#! <NIER>#: Com<WAIT=0.3>  ment un mon<WAIT=0.3>  de consti<WAIT=0.2>  tué que de mots...;165;"The words exploded. It became diffi <WAIT=0.1>cult to discern their  m <WAIT=0.1>eaning. The p <WAIT=0.15>ool of <WAIT=0.05>memo <WAIT=0.2>ies began <WAIT=0.05>to cr  <WAIT=0.1>ack as  infinite black <WAIT=0.15>ness  burrowed its <WAIT=0.05>way into  the wall. <WAIT=0.5>Wei <WAIT=0.1>ss: ""Thi <WAIT=0.2>s world is fa  <WAIT=0.2>lling apart!"" <WAIT=0.5><NIER>: ""How can   <WAIT=0.2>a wo  <WAIT=0.1>rld of  le <WAIT=0.35>t<WAIT=0.25>er"
I implore...<STOP>most important <WAIT=0.2>thing <STOP>wo <WAIT=0.2>rld;Je... <WAIT=0.2>demande... cho<WAIT=0.2>  se la plus impor<WAIT=0.3>  tante au mon<WAIT=0.2>  de...;166;I implore...<STOP>most important <WAIT=0.2>thing <STOP>wo <WAIT=0.2>rld
<LIST=1048>Yo   nah</LIST>;<LIST=1048>  Yo nah</LIST>;169;<LIST=1048>Yo   nah</LIST>
<LIST=1048>Yo   nah</LIST>;<LIST=1048>Yo   nah</LIST>;170;<LIST=1048>Yo   nah</LIST>
<LIST=1048>Yo nah</LIST>;<LIST=1048>Yo nah</LIST>;171;<LIST=1048>Yo nah</LIST>
The light was complete.<PAGE>;La lumière devint absolue.<PAGE>;179;The light was complete.<PAGE>
The memories disappeared.<PAGE>;Les souvenirs disparurent.<PAGE>;184;The memories disappeared.<PAGE>
The tree's identity began to dissolve.<PAGE>;L'identité de l'arbre se désagrégea.<PAGE>;189;The tree's identity began to dissolve.<PAGE>
As the letters slowly faded, <NIER> was drawn back to the real world.;<NIER> fut emporté vers le monde réel alors que les lettres s'estompaient lentement.;190;As the letters slowly faded, <NIER> was drawn back to the real world.
And the tree was satisfied.;Et l'arbre fut satisfait.;191;And the tree was satisfied.
Therefore ... ... ... ... ... ... ... ... ... ... ... ... ... ... ... ... ... ;Autrefois ... ... ... ... ... ... ... ... ... ... ... ... ... ... ...;192;Therefore ... ... ... ... ... ... ... ... ... ... ... ... ... ... ... ... ... 
So, ... ... ... ... ... ... ... ... ... ... ... ... ... ... ... ... ;Alors, ... ... ... ... ... ... ... ... ... ... ... ... ... ... ... ... ...;196;So, ... ... ... ... ... ... ... ... ... ... ... ... ... ... ... ... 
as a pretense for ... ... ... ... ... ... ... ... ... ... ... ... ... ... ... ;ce qui n'était qu'une excuse pour ... ... ... ... ... ... ... ...;201;as a pretense for ... ... ... ... ... ... ... ... ... ... ... ... ... ... ... 
In fact, ... ... ... ... ... ... ... ... ... ... ... ... ... ... ... ... ... ;À vrai dire, ... ... ... ... ... ... ... ... ... ... ... ... ... ... ... ...;206;In fact, ... ... ... ... ... ... ... ... ... ... ... ... ... ... ... ... ... 
Furthermore, ... ... ... ... ... ... ... ... ... ... ... ... ... ... ... ... ;En outre, ... ... ... ... ... ... ... ... ... ... ... ... ... ... ... ...;212;Furthermore, ... ... ... ... ... ... ... ... ... ... ... ... ... ... ... ... 
... ... ... ... ... ... ... ... ... ... ... ... ... ... ... ... and that was the end of that.;... ... ... ... ... ... et on n'en entendit plus jamais parler.;219;... ... ... ... ... ... ... ... ... ... ... ... ... ... ... ... and that was the end of that.
Weiss: Such a fascinating tale.;Weiss#: Quelle histoire fascinante#!;220;Weiss: Such a fascinating tale.
<NIER>: Are you being serious?;<NIER>#: Vraiment#?;221;<NIER>: Are you being serious?
Weiss: Of course not.;Weiss#: Bien sûr que non.;222;Weiss: Of course not.
It was ... ... ... ... ... ... ... ... ... ... ... ... ... ... ... ... ;C'était ... ... ... ... ... ... ... ... ... ... ... ... ... ... ... ... ...;223;It was ... ... ... ... ... ... ... ... ... ... ... ... ... ... ... ... 
However, ... ... ... ... ... ... ... ... ... ... ... ... ... ... ... ... ... ;Cependant, ... ... ... ... ... ... ... ... ... ... ... ... ... ... ... ...;227;However, ... ... ... ... ... ... ... ... ... ... ... ... ... ... ... ... ... 
Meanwhile, my wife was ... ... ... ... ... ... ... ... ... ... ... ...;Pendant ce temps, ma femme était ... ... ... ... ... ... ...;233;Meanwhile, my wife was ... ... ... ... ... ... ... ... ... ... ... ...
And the dismembered corpse had ... ... ... ... ... ... ... ... ... ... ... ... ... ... ... ... ... ;et le corps démembré avait été ... ... ... ... ... ... ... ... ... ...;239;And the dismembered corpse had ... ... ... ... ... ... ... ... ... ... ... ... ... ... ... ... ... 
... ... ... ... ... ... ... ... ... ... ... ... ... ... ... ... ... ... ... ... ...<PAGE>;... ... ... ... ... ... ... ... ... ... ... ... ... ... ... ... ... ... ... ... …<PAGE>;246;... ... ... ... ... ... ... ... ... ... ... ... ... ... ... ... ... ... ... ... ...<PAGE>
The real culprit was ... ... ... ... ... ... ... ... ... ...;Le vrai coupable était ... ... ... ... ... ... ... ... ... ... ... ...;247;The real culprit was ... ... ... ... ... ... ... ... ... ...
.....................! Can you believe it!?;... ... ... ... ... ... ... ... ... ... ... ... ... ... ...#! Qui l'eût cru#!;258;.....................! Can you believe it!?
<NIER>: Um...yeah. That's quite the story.;<NIER>#: Euh, oui... Quelle histoire extraordinaire...!;259;<NIER>: Um...yeah. That's quite the story.
Weiss: I am impressed! Much of this story had been hidden from us, and yet you seem to grasp it.;Weiss#: Tu m'impressionnes#! La majorité de ce récit était cachée, mais tu sembles pourtant l'avoir compris.;260;Weiss: I am impressed! Much of this story had been hidden from us, and yet you seem to grasp it.
<NIER>: Don't be an idiot, Weiss. I don't understand a goddamn thing that's happening right now.;<NIER>#: Ne fais pas l'idiot, Weiss. Je n'ai rien compris du tout.;261;<NIER>: Don't be an idiot, Weiss. I don't understand a goddamn thing that's happening right now.
On that very day, ... ... ... ... ... ... ... ... ... ... ... ... ... ...;Ce jour-là, ... ... ... ... ... ... ... ... ... ... ... ... ... ... ... ...;262;On that very day, ... ... ... ... ... ... ... ... ... ... ... ... ... ...
... ... ... ... ... ... ... ... ... ... ... ever after.;... ... ... ... ... ... ... ... ... ... ... ... jusqu'à la fin des temps.;295;... ... ... ... ... ... ... ... ... ... ... ever after.
<NIER>: ... ...;<NIER>#: ...;296;<NIER>: ... ...
Weiss: ... ... ;Weiss#: ...;297;Weiss: ... ... 
<NIER>: Well, uh... At least they were thorough?;<NIER>#: Eh bien, euh... Au moins, elle n'a pas omis de détails.;298;<NIER>: Well, uh... At least they were thorough?
Weiss: ...Quite.;Weiss#: En effet.;299;Weiss: ...Quite.
I heard you had a job for me. What's up?;J'ai entendu dire que vous aviez du travail pour moi. Qu'y a-t-il#?;300;I heard you had a job for me. What's up?
Well, I had this sudden brainstorm a week ago that the REAL money is in the fortunetelling business! So I'm trying to set up shop.;J'ai eu une idée géniale la semaine dernière#! Je me suis rendu compte que je pourrais faire une fortune en prédisant l'avenir des gens. J'accueillerai bientôt ma première vic... euh, mon premier client#!;301;Well, I had this sudden brainstorm a week ago that the REAL money is in the fortunetelling business! So I'm trying to set up shop.
Fortunetelling, eh?;Vous voulez être diseuse de bonne aventure#?;302;Fortunetelling, eh?
You know it! And once I get my special gazing stone, people will be flocking in from miles around! But...;C'est exact#! Les gens viendront de dizaines de lieux à la ronde pour savoir ce que leur réserve l'avenir#! Seulement...;303;You know it! And once I get my special gazing stone, people will be flocking in from miles around! But...
...But?;Qu'y a-t-il#?;304;...But?
The stone was supposed to be delivered, but it hasn't come. No stone means no customers. And no customers means I'm eating dirt tonight! ...AGAIN!;La pierre de divination que j'avais commandée n'est toujours pas arrivée. Sans elle, je ne peux rien faire#! Et sans clients, je n'aurai rien à me mettre sous la dent#!;305;The stone was supposed to be delivered, but it hasn't come. No stone means no customers. And no customers means I'm eating dirt tonight! ...AGAIN!
Can't you just get another stone?;Ne pouvez-vous pas vous procurer une autre pierre#?;306;Can't you just get another stone?
Well, they're pretty rare. I think Popola knows something about them, but she and I aren't really that close, so I don't want to bug her.;Elles sont plutôt rares... Je crois que Popola saurait où en trouver, mais je ne la connais pas très bien. Je ne voudrais pas la déranger...;307;Well, they're pretty rare. I think Popola knows something about them, but she and I aren't really that close, so I don't want to bug her.
She's a friend of mine. Let me ask.;Popola est une de mes amies. J'irai le lui demander.;308;She's a friend of mine. Let me ask.
Oh, would you? That'd be great!;Oh, vous feriez ça pour moi#? Formidable#!;309;Oh, would you? That'd be great!
I hope you can help me with my stone!;J'espère que vous pourrez m'aider à trouver une pierre de divination#!;310;I hope you can help me with my stone!
Well? Did you find a stone?;Alors#? Avez-vous trouvé une pierre de divination#?;311;Well? Did you find a stone?
This work for you?;Est-ce ce que vous cherchiez#?;312;This work for you?
Yes! That's it! Oh, thank you!;Oui#! C'est justement ce qu'il me fallait#! Oh, merci#!;313;Yes! That's it! Oh, thank you!
Oh, and while you're here...;Oh, et puisque vous êtes là...;314;Oh, and while you're here...
Hey, how about a free reading? Come on, it's the least I can do!;En guise de remerciement, je pourrais prédire votre avenir. Hein, qu'en dites-vous#?;315;Hey, how about a free reading? Come on, it's the least I can do!
Let's see what the Eye has to reveal.;Voyons voir ce que l'œil de puissance peut nous révéler...;316;Let's see what the Eye has to reveal.
Hey, how about a free reading? Come on, it's the least I can do!;En guise de remerciement, je pourrais prédire votre avenir. Hein, qu'en dites-vous#?;318;Hey, how about a free reading? Come on, it's the least I can do!
Let's see what the Eye has to reveal.;Voyons voir ce que l'œil de puissance peut nous révéler...;319;Let's see what the Eye has to reveal.
......Ah!;... Ah#!;321;......Ah!
...What was that?;Qu'est-ce que c'était...?;323;...What was that?
I cannot say, but I doubt it was a mere daydream if all of us experienced it as one.;Je n'en sais rien, mais je doute que cela n'ait été qu'un rêve ordinaire#: nous avons tous partagé la même expérience.;324;I cannot say, but I doubt it was a mere daydream if all of us experienced it as one.
I think I've seen that before...;J'ai l'impression de connaître cet endroit...;325;I think I've seen that before...
Wow! I don't know what happened, but you guys look a little shaken up.;Ouh là#! Je ne sais pas ce qui s'est passé, mais vous avez l'air secoué...;326;Wow! I don't know what happened, but you guys look a little shaken up.
Yeah...;Oui...;327;Yeah...
There is a deep, inner meaning behind this fortune!<PAGE>...Er, but I'm not really sure what it is.<PAGE>Sorry. I guess I need more practice.;Cette vision a une signification profonde et symbolique#!<PAGE>Mais, euh... je ne sais pas ce que c'est...<PAGE>Je suis désolée, c'est la première fois que j'essaie de prédire l'avenir.;328;There is a deep, inner meaning behind this fortune!<PAGE>...Er, but I'm not really sure what it is.<PAGE>Sorry. I guess I need more practice.
Anyway, thanks again for the help. Stop by anytime!;Merci encore de m'avoir aidée. À bientôt, j'espère#!;329;Anyway, thanks again for the help. Stop by anytime!
Actually, I think I'll pass for now...;N'y comptez pas trop.;330;Actually, I think I'll pass for now...
Wait, what? A man with a gold necklace!?;Un instant#! Un homme qui portait un collier en or#?!;331;Wait, what? A man with a gold necklace!?
You know him?;Vous le connaissez#?;332;You know him?
You bet I do! Goddamn bastard ran off with my wife!;Un peu#! Le salaud a couché avec ma femme#!;333;You bet I do! Goddamn bastard ran off with my wife!
Wait a minute. I thought he had a girlfriend.;Mais attendez, je croyais qu'il avait déjà une petite amie.;334;Wait a minute. I thought he had a girlfriend.
If you find him, bring him back here so I can murder the bastard!;Si vous le trouvez, ramenez-le ici que je puisse l'étriper#!;335;If you find him, bring him back here so I can murder the bastard!
Yeah, I'll consider that.<PAGE>So do you know where he went?;Hum, j'y réfléchirai.<PAGE>Alors, savez-vous où il est#?;336;Yeah, I'll consider that.<PAGE>So do you know where he went?
Last I heard, he was heading for Seafront.<PAGE>Goddamn bastard. I can't even bear to look at my wife anymore...;Je crois qu'il est allé à Littoral.<PAGE>Le fumier... À cause de lui, je ne pourrai plus regarder ma femme en face...;337;Last I heard, he was heading for Seafront.<PAGE>Goddamn bastard. I can't even bear to look at my wife anymore...
Looks like he's trying to lose us. Off to Seafront, then.;On dirait qu'il n'est plus ici. Bon, allons à Littoral.;338;Looks like he's trying to lose us. Off to Seafront, then.
Just thinking about it makes me mad enough to KILL!<PAGE>...Not you, of course. But maybe somebody.;Penser à lui me donne envie de tuer quelqu'un#!<PAGE>... Pas vous, bien sûr, mais, euh, quelqu'un d'autre, peut-être...;339;Just thinking about it makes me mad enough to KILL!<PAGE>...Not you, of course. But maybe somebody.
Oh, yeah. That guy came into town selling a bunch of counterfeit merchandise. Don't know how he found buyers for that junk, but apparently he did.;Ah, oui. Il vendait de la camelote. Je ne sais pas comment il a fait pour convaincre des gens d'acheter des trucs pareils, mais...;340;Oh, yeah. That guy came into town selling a bunch of counterfeit merchandise. Don't know how he found buyers for that junk, but apparently he did.
Yes, I saw a child a while back.;Oui, j'ai aperçu un enfant il y a quelques jours.;341;Yes, I saw a child a while back.
I think he was playing over by the Divine Tree.;Je crois qu'il jouait près de l'arbre divin.;342;I think he was playing over by the Divine Tree.
A forest curse? Oh, come now. You know there's no such thing.;La malédiction de la forêt#? Oh, voyons#! Ce n'est qu'un mythe#!;343;A forest curse? Oh, come now. You know there's no such thing.
"...Though if that's what happened, then I suppose ""curse"" might be an appropriate thing to call it.";... M'enfin, avec ce qui est arrivé, je suppose que certains pourraient y croire.;344;"...Though if that's what happened, then I suppose ""curse"" might be an appropriate thing to call it."
