JAP;FR;COUNT;OUPS
Oh, hello! Hi there! How are things?<PAGE>...Huh? You want to know if anything unusual is happening?;Oh, bonjour#! Comment allez-vous#?<PAGE>... Euh, vous voulez savoir s'il se passe des choses étranges par ici#?;1;Oh, hello! Hi there! How are things?<PAGE>...Huh? You want to know if anything unusual is happening?
Well, I have been feeling a rather strange presence whenever I visit the Divine Tree.;Eh bien, je sens une présence insolite chaque fois que je m'approche de l'arbre divin.;2;Well, I have been feeling a rather strange presence whenever I visit the Divine Tree.
The Divine Tree?;L'arbre divin#?;3;The Divine Tree?
Yes. It's a legendary tree that exists in the heart of our village.;Oui, c'est l'arbre millénaire qui s'élève au cœur de notre village.;4;Yes. It's a legendary tree that exists in the heart of our village.
Did you investigate the cause of this...presence?;Avez-vous étudié la cause de cette... présence#?;5;Did you investigate the cause of this...presence?
Uh...not really, no.;Euh, non, pas vraiment.;6;Uh...not really, no.
And why not?;Ah bon#? Pourquoi pas#?;7;And why not?
Well, we're not...we're not really supposed to go near the tree, except for prayer.;Eh bien, nous... Nous ne sommes pas censés nous approcher de l'arbre divin à moins de vouloir prier.;8;Well, we're not...we're not really supposed to go near the tree, except for prayer.
And why is THAT!?;Pourquoi#?;9;And why is THAT!?
I don't know, all right! It's just how things have always been.;Je ne sais pas... C'est simplement la coutume.;10;I don't know, all right! It's just how things have always been.
...Weird.;... Bizarre.;11;...Weird.
There's something strange happening with the Divine Tree.;Il y a quelque chose d'anormal chez l'arbre divin.;12;There's something strange happening with the Divine Tree.
Oh, that reminds me! I have a rather interesting story for you. Would you care to hear it?;Oh, j'oubliais#! J'ai une histoire intéressante à vous raconter. Voulez-vous l'écouter#?;13;Oh, that reminds me! I have a rather interesting story for you. Would you care to hear it?
The weird presence has left the Divine Tree.;Je ne sens plus de présence insolite près de l'arbre divin.;14;The weird presence has left the Divine Tree.
And you know, it really made me think. I mean, why are we worshiping a tree!? Doesn't that seem odd?<PAGE>Sometimes I wonder why we do any of the things we do.;Et vous savez, ça m'a fait réfléchir. Pourquoi rendons-nous un culte à un arbre#?Ça ne vous paraît pas curieux#?<PAGE>Je me demande parfois pourquoi nous faisons les choses telles que nous les faisons.;15;And you know, it really made me think. I mean, why are we worshiping a tree!? Doesn't that seem odd?<PAGE>Sometimes I wonder why we do any of the things we do.
Oh, that reminds me! I have a rather interesting story for you. Would you care to hear it?;Oh, j'oubliais#! J'ai une histoire intéressante à vous raconter. Voulez-vous l'écouter#?;16;Oh, that reminds me! I have a rather interesting story for you. Would you care to hear it?
What, unusual activity? Here? ...No, I don't think so.;Quelque chose d'étrange#? Ici#?... Non, je ne crois pas.;17;What, unusual activity? Here? ...No, I don't think so.
But I DO have an incredible story for you! Wanna hear it?;Mais j'ai une histoire incroyable à vous raconter#! Ça vous dit de l'entendre#?;18;But I DO have an incredible story for you! Wanna hear it?
The key to the Shadowlord's castle? You're talking crazy talk!;La clef du château du Maître des Ombres#? Mais qu'est-ce que vous racontez#?!;19;The key to the Shadowlord's castle? You're talking crazy talk!
Anyway, enough of your madness. Let's talk about MY story!;Assez de sottises#! Laissez-moi vous raconter MON histoire#!;20;Anyway, enough of your madness. Let's talk about MY story!
We are the grass... We are the trees... We are the woods...;Nous sommes l'herbe... Nous sommes les arbres... Nous sommes la forêt...;21;We are the grass... We are the trees... We are the woods...
Why do we seem to encounter nothing but odd people lately?;Pourquoi ne rencontrons-nous que des entités étranges ces derniers temps#?;24;Why do we seem to encounter nothing but odd people lately?
You should talk, Weiss.;Tu peux bien parler, Weiss#!;25;You should talk, Weiss.
Pah! As if Grimiore Weiss is capable of spouting such nonsense!;Pfft#! Le Grimoire Weiss ne débiterait jamais de telles sottises#!;26;Pah! As if Grimiore Weiss is capable of spouting such nonsense!
Hang on. I don't think he's done.;Attends, je crois qu'elle n'a pas fini.;27;Hang on. I don't think he's done.
...The dark form that governs all memories.;... L'essence sombre qui gouverne tous les souvenirs.;28;...The dark form that governs all memories.
...May the words form themselves to your liking.;... Que les mots se construisent comme vous le désirez.;29;...May the words form themselves to your liking.
That would be nice.;Euh, merci...?;32;That would be nice.
Ugh...;Hum...;33;Ugh...
...You let it slip through your fingers.;Tu le laisserais te filer entre les doigts...?;34;...You let it slip through your fingers.
Give me a break! I have to go back to that stupid land of words!?;Tu rigoles#?! Je dois retourner dans ce ridicule univers peuplé de mots#?!;35;Give me a break! I have to go back to that stupid land of words!?
What in the...?;Mais que...?;36;What in the...?
I never realized that Shades were capable of rational thought.;Je ne m'étais jamais rendu compte que les Ombres pouvaient posséder un esprit rationnel.;37;I never realized that Shades were capable of rational thought.
I don't care if they can tap dance and play the fiddle.;Qu'elles fassent des claquettes ou jouent du violon, je m'en fiche.;38;I don't care if they can tap dance and play the fiddle.
Can't I just kill something without all this voodoo nonsense?;Ce serait trop demander de pouvoir tuer un ennemi sans avoir à endurer toutes ces absurdités#?;39;Can't I just kill something without all this voodoo nonsense?
With the tree defeated, we no longer have to worry about being buried in its world of letters.;Puisque nous avons vaincu l'arbre, nous n'avons plus à craindre de nous faire engloutir dans son univers de lettres.;40;With the tree defeated, we no longer have to worry about being buried in its world of letters.
Unless, of course, time itself begins to rewind... Hmm... ;À moins, bien sûr, que le temps ne s'écoule soudainement à rebours... Hum...;41;Unless, of course, time itself begins to rewind... Hmm... 
Black. Pure darkness. Painted over everything.;Le noir... L'obscurité profonde... Elle recouvre tout.;42;Black. Pure darkness. Painted over everything.
Words. Scattered here and there across the blackness.;Des mots sont dispersés ici et là dans les ténèbres.;43;Words. Scattered here and there across the blackness.
Kind words. Difficult words. Amorous words. All sparkling in the dark like jewels.;Des mots aimables... Des mots difficiles... Des mots d'amour... Des joyaux qui scintillent dans le noir...;44;Kind words. Difficult words. Amorous words. All sparkling in the dark like jewels.
The words were few now. But time was shorter.;Les mots sont peu nombreux. Et le temps presse.;45;The words were few now. But time was shorter.
Grabbing the words in desperation, the tree turned to the sky.;Saisissant désespérément les mots, l'arbre se tourna vers le ciel.;46;Grabbing the words in desperation, the tree turned to the sky.
<FONT=ITALIC>This is wrong,</FONT> whispered the tree in the voice of wind through the leaves. <FONT=ITALIC>This is not how it was supposed to be.</FONT>;<FONT=ITALIC>Quelque chose ne va pas,</FONT> murmura l'arbre avec la voix du vent qui souffle parmi les feuilles. <FONT=ITALIC>Ce n'est pas ce qui devait arriver.</FONT>;47;<FONT=ITALIC>This is wrong,</FONT> whispered the tree in the voice of wind through the leaves. <FONT=ITALIC>This is not how it was supposed to be.</FONT>
<FONT=ITALIC>...The plan has failed.</FONT>;<FONT=ITALIC>... Le plan a échoué.</FONT>;48;<FONT=ITALIC>...The plan has failed.</FONT>
Once, long ago, the tree had remembered everything about the world. This was its task. Its purpose.;Jadis, l'arbre savait tout au sujet du monde. C'était sa tâche. Sa raison d'être.;49;Once, long ago, the tree had remembered everything about the world. This was its task. Its purpose.
"It shivered with something approaching joy as it collected the memories of mankind. <STOP>This was no accident; emotions were as much a part of the tree as root and bark.";Il tressaillait presque de joie en rassemblant les souvenirs de l'Homme. <STOP>Ceci n'était pas étrange, car les émotions faisaient autant partie de l'arbre que ses racines et son écorce.;50;"It shivered with something approaching joy as it collected the memories of mankind. <STOP>This was no accident; emotions were as much a part of the tree as root and bark."
Memories collected like dew on the thick green leaves of the tree. ;Les souvenirs s'accumulaient sur ses épaisses feuilles vertes telles des perles de rosée.;51;Memories collected like dew on the thick green leaves of the tree. 
And once they had formed a web that spanned the entire world.;Autrefois, ils avaient tissé une toile qui recouvrait le monde entier.;52;And once they had formed a web that spanned the entire world.
Words collapsed into sunlight before passing through the leaves and into the pool of memory. From the pool, the words joined together to form colonies, the colonies united into whirlpools of light, and the light coalesced into stars. <STOP>Each star was like a child of the tree, and it loved them all. ;Décomposés par la lumière du soleil, les mots passaient à travers les feuilles et tombaient dans le bassin de la mémoire. Dans ce bassin, ils constituaient des colonies qui s'unissaient en tourbillons de lumière et cette lumière formait ensuite des étoiles. <STOP>L'arbre considérait chacune de ces étoiles comme son enfant et les chérissait toutes.;53;Words collapsed into sunlight before passing through the leaves and into the pool of memory. From the pool, the words joined together to form colonies, the colonies united into whirlpools of light, and the light coalesced into stars. <STOP>Each star was like a child of the tree, and it loved them all. 
<FONT=ITALIC>Look at my memory.</FONT>;<FONT=ITALIC>Regardez mes souvenirs...</FONT>;54;<FONT=ITALIC>Look at my memory.</FONT>
A child is here, brought low by disease. He is far too young to have suffered so.;Un enfant affaibli par la maladie. Il semble être beaucoup trop jeune pour avoir autant souffert.;55;A child is here, brought low by disease. He is far too young to have suffered so.
Thin beyond words, the boy's skin is a shade paler than the bleached hospital sheets upon which he lies. <STOP>His parents no longer visit him, for they cannot bear to watch him suffer. The doctors have long since surrendered his fate to the gods.;La peau de son corps émacié est plus pâle encore que les draps de son lit. <STOP>Ses parents ne lui rendent plus visite, car ils ne supportent pas de le voir souffrir. Il y a longtemps que les docteurs ont remis son sort dans les mains des dieux.;56;Thin beyond words, the boy's skin is a shade paler than the bleached hospital sheets upon which he lies. <STOP>His parents no longer visit him, for they cannot bear to watch him suffer. The doctors have long since surrendered his fate to the gods.
The boy, too, has abandoned hope. Strange emotions—;Le garçon a lui aussi perdu espoir. Des émotions inquiétantes,;57;The boy, too, has abandoned hope. Strange emotions—
weariness, hatred—swell within the dark recesses of his young heart. <STOP>He tries to reject the black terror that germinates in his body, but no amount of effort or tears can drive the invader away.;la lassitude, la haine, se bousculent dans les profondeurs de son jeune cœur. <STOP>Il essaie de combattre l'horreur obscure qui germe dans son corps, mais ses piètres efforts et ses larmes ne sont pas de taille contre cet envahisseur.;58;weariness, hatred—swell within the dark recesses of his young heart. <STOP>He tries to reject the black terror that germinates in his body, but no amount of effort or tears can drive the invader away.
He has long ceased to resent his parents and doctors. Once he did, but now his pain is so great that there is little room in his heart to think of others.;Il n'éprouve plus de ressentiment à l'égard de ses parents et des docteurs depuis longtemps. Autrefois, il leur en voulait, mais désormais, la douleur l'accable tant qu'il n'arrive plus à se soucier des autres.;59;He has long ceased to resent his parents and doctors. Once he did, but now his pain is so great that there is little room in his heart to think of others.
Only one person brings the boy comfort: a healthy young girl with tan skin and deep brown eyes.;La seule personne qui sait le soulager est une jeune fille basanée aux yeux bruns.;60;Only one person brings the boy comfort: a healthy young girl with tan skin and deep brown eyes.
Only one person brings the boy comfort: a healthy young girl with tan skin and deep green eyes.;La seule personne qui sait le soulager est une jeune fille basanée aux yeux verts.;61;Only one person brings the boy comfort: a healthy young girl with tan skin and deep green eyes.
Only one person brings the boy comfort: a healthy young girl with tan skin and deep blue eyes.;La seule personne qui sait le soulager est une jeune fille basanée aux yeux bleus.;62;Only one person brings the boy comfort: a healthy young girl with tan skin and deep blue eyes.
"She is a beacon of brightness and light in the boy's world; her very presence is a comfort to him. ";Elle est le seul rayon de lumière dans le monde du garçon. L'éclat de sa présence le réconforte.;63;"She is a beacon of brightness and light in the boy's world; her very presence is a comfort to him. "
But he is unable to look upon her face.;Mais il ne peut pas la regarder.;64;But he is unable to look upon her face.
Whenever they meet, the boy is filled with loathing for his own state. Soon, this loathing eats away at what joy he receives from the girl's visits.;Chaque fois qu'il la rencontre, un dégoût profond pour sa situation l'envahit. Ce dégoût corrompt rapidement la joie qu'il ressent en présence de la jeune fille.;65;Whenever they meet, the boy is filled with loathing for his own state. Soon, this loathing eats away at what joy he receives from the girl's visits.
The girl will stop coming. He knows this. His every waking moment is spent in fear of this day.<PAGE>;Un jour, elle ne viendra plus le voir. Il le sait bien. Il passe ses journées à le craindre.;66;The girl will stop coming. He knows this. His every waking moment is spent in fear of this day.<PAGE>
He thinks that if he could talk to her, if he could tell her of his feelings, that this might not be so. But this conversation never happens.;Il croit que s'il pouvait lui parler, s'il pouvait seulement lui dire ce qu'il ressent, ce jour ne viendrait peut-être pas.<PAGE>Mais cette conversation n'a jamais lieu.;67;He thinks that if he could talk to her, if he could tell her of his feelings, that this might not be so. But this conversation never happens.
The girl disappears.;La jeune fille disparaît.;68;The girl disappears.
The boy dies alone.;Le garçon meurt seul.;69;The boy dies alone.
The tree scoops up this memory and carefully stores it within itself. Etched upon it is a single word: Envy.;L'arbre ramasse ce souvenir et l'entrepose soigneusement en son sein. Un mot y est gravé#: «#envie#».;70;The tree scoops up this memory and carefully stores it within itself. Etched upon it is a single word: Envy.
<FONT=ITALIC>Look at my memory.</FONT>;<FONT=ITALIC>Regardez mes souvenirs...</FONT>;71;<FONT=ITALIC>Look at my memory.</FONT>
There is a female warrior.;Une guerrière redoutable.;72;There is a female warrior.
Her greatest enemy is a beast with red eyes that she cannot fully comprehend. When she strikes it with her sword, it turns into a pillar of salt and dies.;Son plus grand ennemi est une créature aux yeux ardents qu'elle n'a jamais su comprendre. Lorsqu'elle la taillade de son épée, celle-ci se transforme en statue de sel.;73;Her greatest enemy is a beast with red eyes that she cannot fully comprehend. When she strikes it with her sword, it turns into a pillar of salt and dies.
But when the white smoke clears, a new enemy rises.;Cependant, une fois la poussière dissipée, une autre créature surgit…;74;But when the white smoke clears, a new enemy rises.
<STOP>And another.;<STOP>Et une autre...;75;<STOP>And another.
<STOP>...And another.;<STOP>Toujours une autre...;76;<STOP>...And another.
The warrior knows that her struggle is folly, but fighting the unending stream of enemies fills her with a sense of joy and purpose.;La guerrière sait bien qu'elle lutte en vain, mais combattre le flot perpétuel d'ennemis la motive et la remplit de joie.;77;The warrior knows that her struggle is folly, but fighting the unending stream of enemies fills her with a sense of joy and purpose.
"Somewhere deep in the warrior's drug-addled mind lies a vague memory of a daughter. <STOP>Perhaps the child exists only in her head; the dying remnants of a powerful dream. She does not know.";Quelque part dans les profondeurs de son esprit abruti par la drogue se tapit le souvenir d'une enfant. <STOP>Sa fille n'existe peut-être que dans sa tête. Elle n'est sans doute que le vestige d'un rêve troublant. Elle l'ignore.;78;"Somewhere deep in the warrior's drug-addled mind lies a vague memory of a daughter. <STOP>Perhaps the child exists only in her head; the dying remnants of a powerful dream. She does not know."
Her friends and fellow warriors come and go. Some flee in terror. Some are eaten. <STOP>She began the fight with 23 companions, but most are gone now.;Ses camarades de régiment ont tous fini par la quitter. Certains se sont enfuis, terrifiés. D'autres se sont fait dévorer. <STOP>Au début, elle avait vingt-trois compagnons, mais il ne lui en reste plus.;79;Her friends and fellow warriors come and go. Some flee in terror. Some are eaten. <STOP>She began the fight with 23 companions, but most are gone now.
Her friends and fellow warriors come and go. Some flee in terror. Some are eaten. <STOP>She began the fight with 33 companions, but most are gone now.;Ses camarades de régiment ont tous fini par la quitter. Certains se sont enfuis, terrifiés. D'autres se sont fait dévorer. <STOP>Au début, elle avait trente-trois compagnons, mais il ne lui en reste plus.;80;Her friends and fellow warriors come and go. Some flee in terror. Some are eaten. <STOP>She began the fight with 33 companions, but most are gone now.
Her friends and fellow warriors come and go. Some flee in terror. Some are eaten. <STOP>She began the fight with 63 companions, but most are gone now.;Ses camarades de régiment ont tous fini par la quitter. Certains se sont enfuis, terrifiés. D'autres se sont fait dévorer. <STOP>Au début, elle avait soixante-trois compagnons, mais il ne lui en reste plus.;81;Her friends and fellow warriors come and go. Some flee in terror. Some are eaten. <STOP>She began the fight with 63 companions, but most are gone now.
The warrior's body shudders. She does not understand why at first.;Le corps de la guerrière tressaillit. Elle ne sait d'abord pas pourquoi.;82;The warrior's body shudders. She does not understand why at first.
By the time she hears the fierce, low sound, the arena is already enclosed in darkness. Looking up, the warrior sees a beast so large that it blots out the sky.;Les ténèbres ont déjà envahi l'arène lorsqu'elle entend un grognement sourd et guttural. Levant les yeux, la guerrière aperçoit un monstre gigantesque qui obscurcit le ciel.;83;By the time she hears the fierce, low sound, the arena is already enclosed in darkness. Looking up, the warrior sees a beast so large that it blots out the sky.
She is laughing. She has been doing so for as long as she can remember.;Elle rit... Elle rit à en perdre haleine depuis toujours.;84;She is laughing. She has been doing so for as long as she can remember.
Covered in blood and dirt, the warrior laughs. She laughs and laughs until the town that contains her daughter collapses into a pile of dust.;Maculée de sang et de boue, la guerrière s'étouffe de rire. Elle rit sans pouvoir s'arrêter jusqu'à ce que la ville qui recèle sa fille soit réduite en poussière.;85;Covered in blood and dirt, the warrior laughs. She laughs and laughs until the town that contains her daughter collapses into a pile of dust.
This memory has been stored for a long time. It is etched with a single word: Loss.;Il y a longtemps que l'arbre a entreposé ce souvenir. Un mot y est gravé#: «#perte#».;86;This memory has been stored for a long time. It is etched with a single word: Loss.
<FONT=ITALIC>Look at my memory.</FONT>;<FONT=ITALIC>Regardez mes souvenirs...</FONT>;87;<FONT=ITALIC>Look at my memory.</FONT>
A red dragon falls from the heavens... ;Un dragon écarlate descend des cieux.;88;A red dragon falls from the heavens... 
<FONT=ITALIC>Ah, that memory has been lost. A shame. It was a favorite of mine.</FONT>;<FONT=ITALIC>Ah, j'ai perdu ce souvenir. Dommage. C'était un de mes favoris.</FONT>;89;<FONT=ITALIC>Ah, that memory has been lost. A shame. It was a favorite of mine.</FONT>
After many centuries of existence, the tree saw that its carefully labeled memories were beginning to dwindle.;Après des siècles, l'arbre se rendit compte que ses souvenirs, si soigneusement catalogués, diminuaient.;90;After many centuries of existence, the tree saw that its carefully labeled memories were beginning to dwindle.
Once seemingly infinite, the memories now seemed ready to disappear forever.;Autrefois apparemment infinis, les souvenirs semblaient désormais pouvoir disparaître à tout jamais.;91;Once seemingly infinite, the memories now seemed ready to disappear forever.
"The tree did not feel sadness at this; grief was an emotion beyond its comprehension.";L'arbre ne s'en attrista pas. Le chagrin était une émotion qui dépassait maintenant son entendement.;92;"The tree did not feel sadness at this; grief was an emotion beyond its comprehension."
It did, however, have the distinct feeling that something was missing.;Par contre, il eut la nette impression qu'il lui manquait quelque chose.;93;It did, however, have the distinct feeling that something was missing.
The mountain of memories it had so carefully assembled had disappeared.;La multitude de souvenirs qu'il avait rassemblés avec tant de précaution avait disparu.;94;The mountain of memories it had so carefully assembled had disappeared.
The tree stretched its branches as far as it could, but new memories refused to flow.;L'arbre étendit ses branches le plus loin possible, mais il ne put récupérer aucun nouveau souvenir.;95;The tree stretched its branches as far as it could, but new memories refused to flow.
"The pool of memories was a black, empty pit; a hollow place where life had once flourished.";Le bassin de la mémoire n'était plus qu'un large trou béant, un espace vide où la vie avait jadis prospéré.;96;"The pool of memories was a black, empty pit; a hollow place where life had once flourished."
The tree had lost its purpose.;L'arbre avait perdu sa raison d'être.;97;The tree had lost its purpose.
There was nothing to be done but sift through the few remaining memories littering the ground under its branches.;Il n'avait plus rien d'autre à faire que d'examiner le peu de souvenirs qui gisaient sur le sol sous ses branches.;98;There was nothing to be done but sift through the few remaining memories littering the ground under its branches.
This is why the tree was pleased when the man and his companion entered the room.;C'est pourquoi il fut ravi de voir l'homme et son compagnon entrer dans la salle.;99;This is why the tree was pleased when the man and his companion entered the room.
<NIER>: Well, this place is gloomy as hell.;<NIER>#: Dis donc, cet endroit est plutôt lugubre.;100;<NIER>: Well, this place is gloomy as hell.
The room <NIER> had entered was almost completely empty.;La pièce où se tenait <NIER> était presque vide.;101;The room <NIER> had entered was almost completely empty.
All he could see were a few crystals scattered haphazardly on the ground.;Il n'y avait que quelques cristaux éparpillés sur le sol.;102;All he could see were a few crystals scattered haphazardly on the ground.
Picking up one of the crystals and peering into it, <NIER> suddenly saw a familiar sight. ;<NIER> en ramassa un et y jeta un coup d'œil. Il reconnut tout de suite la forêt des légendes.;103;Picking up one of the crystals and peering into it, <NIER> suddenly saw a familiar sight. 
It was the Forest of Myth—its villagers prisoners of their own dreams.;Les villageois y étaient prisonniers de leurs propres rêves.;104;It was the Forest of Myth—its villagers prisoners of their own dreams.
<FONT=ITALIC>I apologize,</FONT> the tree thought. <FONT=ITALIC>That is all that remains.</FONT>;<FONT=ITALIC>Je suis désolé,</FONT> pensa l'arbre. <FONT=ITALIC>C'est tout ce qui reste.</FONT>;105;<FONT=ITALIC>I apologize,</FONT> the tree thought. <FONT=ITALIC>That is all that remains.</FONT>
As <NIER> stared at the jewel, bewildered, a voice suddenly called out from the depths of his mind.;Tandis que <NIER> examinait la gemme, perplexe, une voix l'interpella dans son esprit.;106;As <NIER> stared at the jewel, bewildered, a voice suddenly called out from the depths of his mind.
The voice implored them to listen.;Cette voix l'implora d'écouter.;107;The voice implored them to listen.
It was an order. Following it was mandatory.;C'était un ordre. Il devait y obéir.;108;It was an order. Following it was mandatory.
